{
  "reference": "reference",
  "target": "target",
  "ignore": ["tooling/"],
  "lineDeletions": [
    {
      "filePath": "schema.sql",
      "ranges": [
        {
          "start": 0,
          "end": 0
        }
      ]
    }
  ],
  "replacements": [
    {
      "from": "ref_storage",
      "to": "storage"
    }
  ]
}
